{
  "schemaVersion": 1,
  "kind": "hvm-testlab-host-report",
  "generatedAt": "2026-10-26T15:59:59Z",
  "runId": "20261026T155956Z",
  "appVersion": "1.0",
  "appBuild": "1",
  "artifactSha256": "1a45deb57843bcb2722059c5e64a96923df74f8d41f5b646c5c00865be069114",
  "sandboxMode": "hvm-home",
  "host": {
    "system": "Linux",
    "release": "6.17.0-1022-azure",
    "machine": "x86_64",
    "python": "3.12.3",
    "pageSize": 4096,
    "compiler": "Ubuntu clang version 18.1.3 (1ubuntu1)",
    "emulatorCommit": "3f6ff5100d5802d1a8f3fbceb9ba6243d08363e2",
    "emulatorDirty": true
  },
  "startTime": "2026-10-26T15:59:59Z",
  "cases": [
    {
      "id": "TL-A",
      "version": 1,
      "status": "passed",
      "durationMs": 80.7,
      "clockDefinition": "CLOCK_MONOTONIC (host)",
      "checkpointWritten": null,
      "diagnostics": {
        "hvmExitCode": 0,
        "elapsedSec": 0.081,
        "stdoutTail": "TESTLAB TL-A passed\ntestlab: result written to /var/mobile/Applications/146230E2-1634-233A-0D7A-4E4819D5086A/Documents/testlab_result.json (ok)\n"
      }
    },
    {
      "id": "TL-B",
      "version": 1,
      "status": "passed",
      "durationMs": 125.5,
      "clockDefinition": "CLOCK_MONOTONIC (host)",
      "checkpointWritten": null,
      "diagnostics": {
        "hvmExitCode": 0,
        "elapsedSec": 0.126,
        "stdoutTail": "TESTLAB TL-B passed\ntestlab: result written to /var/mobile/Applications/146230E2-1634-233A-0D7A-4E4819D5086A/Documents/testlab_result.json (ok)\n"
      }
    },
    {
      "id": "TL-C",
      "version": 1,
      "status": "passed",
      "durationMs": 81.8,
      "clockDefinition": "CLOCK_MONOTONIC (host)",
      "checkpointWritten": null,
      "diagnostics": {
        "hvmExitCode": 0,
        "elapsedSec": 0.082,
        "stdoutTail": "TESTLAB TL-C passed\ntestlab: result written to /var/mobile/Applications/146230E2-1634-233A-0D7A-4E4819D5086A/Documents/testlab_result.json (ok)\n"
      }
    },
    {
      "id": "TL-D",
      "version": 1,
      "status": "passed",
      "durationMs": 79.8,
      "clockDefinition": "CLOCK_MONOTONIC (host)",
      "checkpointWritten": null,
      "diagnostics": {
        "hvmExitCode": 0,
        "elapsedSec": 0.08,
        "stdoutTail": "TESTLAB TL-D passed\ntestlab: result written to /var/mobile/Applications/146230E2-1634-233A-0D7A-4E4819D5086A/Documents/testlab_result.json (ok)\n"
      }
    },
    {
      "id": "TL-E",
      "version": 1,
      "status": "passed",
      "durationMs": 81.4,
      "clockDefinition": "CLOCK_MONOTONIC (host)",
      "checkpointWritten": null,
      "diagnostics": {
        "hvmExitCode": 0,
        "elapsedSec": 0.081,
        "stdoutTail": "TESTLAB TL-E passed\ntestlab: result written to /var/mobile/Applications/146230E2-1634-233A-0D7A-4E4819D5086A/Documents/testlab_result.json (ok)\n",
        "phase1Result": "skipped"
      }
    },
    {
      "id": "TL-F",
      "version": 1,
      "status": "passed",
      "durationMs": 79.8,
      "clockDefinition": "CLOCK_MONOTONIC (host)",
      "checkpointWritten": null,
      "diagnostics": {
        "hvmExitCode": 0,
        "elapsedSec": 0.08,
        "stdoutTail": "TESTLAB TL-F passed\ntestlab: result written to /var/mobile/Applications/146230E2-1634-233A-0D7A-4E4819D5086A/Documents/testlab_result.json (ok)\n"
      }
    },
    {
      "id": "TL-G",
      "version": 1,
      "status": "passed",
      "durationMs": 79.7,
      "clockDefinition": "CLOCK_MONOTONIC (host)",
      "checkpointWritten": null,
      "diagnostics": {
        "hvmExitCode": 0,
        "elapsedSec": 0.08,
        "stdoutTail": "TESTLAB TL-G passed\ntestlab: result written to /var/mobile/Applications/146230E2-1634-233A-0D7A-4E4819D5086A/Documents/testlab_result.json (ok)\n"
      }
    },
    {
      "id": "TL-H",
      "version": 1,
      "status": "passed",
      "durationMs": 79.9,
      "clockDefinition": "CLOCK_MONOTONIC (host)",
      "checkpointWritten": null,
      "diagnostics": {
        "hvmExitCode": 0,
        "elapsedSec": 0.08,
        "stdoutTail": "TESTLAB TL-H passed\ntestlab: result written to /var/mobile/Applications/146230E2-1634-233A-0D7A-4E4819D5086A/Documents/testlab_result.json (ok)\n"
      }
    },
    {
      "id": "TL-I",
      "version": 1,
      "status": "passed",
      "durationMs": 80.3,
      "clockDefinition": "CLOCK_MONOTONIC (host)",
      "checkpointWritten": null,
      "diagnostics": {
        "hvmExitCode": 0,
        "elapsedSec": 0.08,
        "stdoutTail": "TESTLAB TL-I passed\ntestlab: result written to /var/mobile/Applications/146230E2-1634-233A-0D7A-4E4819D5086A/Documents/testlab_result.json (ok)\n"
      }
    },
    {
      "id": "TL-J",
      "version": 1,
      "status": "passed",
      "durationMs": 127.6,
      "clockDefinition": "CLOCK_MONOTONIC (host)",
      "checkpointWritten": null,
      "diagnostics": {
        "hvmExitCode": 0,
        "elapsedSec": 0.128,
        "stdoutTail": "TESTLAB TL-J passed\ntestlab: result written to /var/mobile/Applications/146230E2-1634-233A-0D7A-4E4819D5086A/Documents/testlab_result.json (ok)\n"
      }
    },
    {
      "id": "TL-K",
      "version": 1,
      "status": "passed",
      "durationMs": 80.8,
      "clockDefinition": "CLOCK_MONOTONIC (host)",
      "checkpointWritten": null,
      "diagnostics": {
        "hvmExitCode": 0,
        "elapsedSec": 0.081,
        "stdoutTail": "TESTLAB TL-K passed\ntestlab: result written to /var/mobile/Applications/146230E2-1634-233A-0D7A-4E4819D5086A/Documents/testlab_result.json (ok)\n"
      }
    },
    {
      "id": "TL-L",
      "version": 1,
      "status": "passed",
      "durationMs": 1056.9,
      "clockDefinition": "CLOCK_MONOTONIC (host)",
      "checkpointWritten": null,
      "diagnostics": {
        "hvmExitCode": 0,
        "elapsedSec": 1.057,
        "stdoutTail": "TESTLAB TL-L passed\ntestlab: result written to /var/mobile/Applications/146230E2-1634-233A-0D7A-4E4819D5086A/Documents/testlab_result.json (ok)\n",
        "saveVerifiedByHost": true
      }
    },
    {
      "id": "TL-M",
      "version": 1,
      "status": "passed",
      "durationMs": 81.1,
      "clockDefinition": "CLOCK_MONOTONIC (host)",
      "checkpointWritten": null,
      "diagnostics": {
        "hvmExitCode": 0,
        "elapsedSec": 0.081,
        "stdoutTail": "TESTLAB TL-M passed\ntestlab: result written to /var/mobile/Applications/146230E2-1634-233A-0D7A-4E4819D5086A/Documents/testlab_result.json (ok)\n"
      }
    },
    {
      "id": "TL-N",
      "version": 1,
      "status": "passed",
      "durationMs": 82.0,
      "clockDefinition": "CLOCK_MONOTONIC (host)",
      "checkpointWritten": null,
      "diagnostics": {
        "hvmExitCode": 0,
        "elapsedSec": 0.082,
        "stdoutTail": "TESTLAB TL-N passed\ntestlab: result written to /var/mobile/Applications/146230E2-1634-233A-0D7A-4E4819D5086A/Documents/testlab_result.json (ok)\n"
      }
    },
    {
      "id": "TL-O",
      "version": 1,
      "status": "passed",
      "durationMs": 80.9,
      "clockDefinition": "CLOCK_MONOTONIC (host)",
      "checkpointWritten": null,
      "diagnostics": {
        "hvmExitCode": 0,
        "elapsedSec": 0.081,
        "stdoutTail": "TESTLAB TL-O passed\ntestlab: result written to /var/mobile/Applications/146230E2-1634-233A-0D7A-4E4819D5086A/Documents/testlab_result.json (ok)\n"
      }
    },
    {
      "id": "TL-P",
      "version": 1,
      "status": "passed",
      "durationMs": 81.5,
      "clockDefinition": "CLOCK_MONOTONIC (host)",
      "checkpointWritten": null,
      "diagnostics": {
        "hvmExitCode": 0,
        "elapsedSec": 0.081,
        "stdoutTail": "TESTLAB TL-P passed\ntestlab: result written to /var/mobile/Applications/146230E2-1634-233A-0D7A-4E4819D5086A/Documents/testlab_result.json (ok)\n"
      }
    },
    {
      "id": "TL-Q",
      "version": 1,
      "status": "passed",
      "durationMs": 127.8,
      "clockDefinition": "CLOCK_MONOTONIC (host)",
      "checkpointWritten": null,
      "diagnostics": {
        "hvmExitCode": 0,
        "elapsedSec": 0.128,
        "stdoutTail": "TESTLAB TL-Q passed\ntestlab: result written to /var/mobile/Applications/146230E2-1634-233A-0D7A-4E4819D5086A/Documents/testlab_result.json (ok)\n"
      }
    },
    {
      "id": "TL-R",
      "version": 1,
      "status": "passed",
      "durationMs": 79.9,
      "clockDefinition": "CLOCK_MONOTONIC (host)",
      "checkpointWritten": null,
      "diagnostics": {
        "hvmExitCode": 0,
        "elapsedSec": 0.08,
        "stdoutTail": "TESTLAB TL-R passed\ntestlab: result written to /var/mobile/Applications/146230E2-1634-233A-0D7A-4E4819D5086A/Documents/testlab_result.json (ok)\n"
      }
    }
  ]
}