{
  "schemaVersion" : 1,
  "kind" : "hvm-testlab-result",
  "generatedAt" : "2026-10-26T15:59:59Z",
  "runId" : "00000000113797A5",
  "appVersion" : "1.0",
  "appBuild" : "1",
  "sandboxMode" : "hvm-home",
  "cases" : [
    {
      "id" : "TL-R",
      "version" : 1,
      "status" : "passed",
      "expected" : {
        "focus" : true,
        "unicodeInsertion" : true,
        "delegateVeto" : true,
        "unicodeDeletion" : true,
        "emptyDeletionNoEdit" : true,
        "programmaticSetNoEditEvents" : true,
        "focusVeto" : true
      },
      "actual" : {
        "focus" : true,
        "unicodeInsertion" : true,
        "delegateVeto" : true,
        "unicodeDeletion" : true,
        "emptyDeletionNoEdit" : true,
        "programmaticSetNoEditEvents" : true,
        "focusVeto" : true
      },
      "durationMs" : 0,
      "clockDefinition" : "CLOCK_MONOTONIC",
      "checkpointWritten" : false
    }
  ]
}