{
  "schemaVersion" : 1,
  "kind" : "hvm-testlab-result",
  "generatedAt" : "2026-10-26T05:33:50Z",
  "runId" : "000000001F0E1461",
  "appVersion" : "1.0",
  "appBuild" : "1",
  "sandboxMode" : "hvm-home",
  "cases" : [
    {
      "id" : "TL-Q",
      "version" : 1,
      "status" : "passed",
      "expected" : {
        "englishLTR" : true,
        "arabicHebrewPersianRTL" : true,
        "urduRTL" : true
      },
      "actual" : {
        "englishLTR" : true,
        "arabicHebrewPersianRTL" : true,
        "urduRTL" : true
      },
      "durationMs" : 0,
      "clockDefinition" : "CLOCK_MONOTONIC",
      "checkpointWritten" : false
    }
  ]
}