{
  "schemaVersion" : 1,
  "kind" : "hvm-testlab-result",
  "generatedAt" : "2026-10-25T23:01:51Z",
  "runId" : "00000000138E61E9",
  "appVersion" : "1.0",
  "appBuild" : "1",
  "sandboxMode" : "hvm-home",
  "cases" : [
    {
      "id" : "TL-O",
      "version" : 1,
      "status" : "passed",
      "expected" : {
        "floatAggregate" : true,
        "doubleAggregate" : true
      },
      "actual" : {
        "floatAggregate" : true,
        "doubleAggregate" : true
      },
      "durationMs" : 0,
      "clockDefinition" : "CLOCK_MONOTONIC",
      "checkpointWritten" : false
    }
  ]
}